{
  "version": 1,
  "channel_id": "ch-46",
  "strategy": "CINEMATIC_STATEMENT",
  "name": "ch-46-cinematic-statement-interior-room",
  "intent": "No richer representation was available for this beat, so the frame is composed rather than filled. Here that is answer frame on a room's floor and back wall, furniture implied at the edges.",
  "environment": {
    "type": "interior-room",
    "ground": "a room's floor and back wall, furniture implied at the edges",
    "lighting": "soft-diffuse"
  },
  "objects": [
    {
      "object": "answer frame",
      "role": "subject",
      "anchor": {
        "x": 0.5,
        "y": 0.48,
        "scale": 1.05
      }
    },
    {
      "object": "desk edge",
      "role": "supporting",
      "anchor": {
        "x": 0.78,
        "y": 0.8,
        "scale": 0.5
      }
    },
    {
      "object": "question line",
      "role": "context",
      "anchor": {
        "x": 0.22,
        "y": 0.8,
        "scale": 0.5
      }
    }
  ],
  "camera_path": [
    {
      "at": 0,
      "move": "tilt-up",
      "reason": "one object holds the frame"
    },
    {
      "at": 0.55,
      "move": "pan-right",
      "target": "answer frame",
      "reason": "the camera moves slowly enough to be felt rather than watched"
    },
    {
      "at": 1,
      "move": "push-in",
      "reason": "the frame settles"
    }
  ],
  "typography": [
    {
      "slot": "{line}",
      "face": "secondary",
      "placement": "centre",
      "in_at": 0.12,
      "out_at": 1
    }
  ],
  "transitions": [
    {
      "to": "next",
      "type": "fade-section",
      "duration_frames": 10
    }
  ],
  "parameters": {
    "line": {
      "type": "text",
      "from": "script-phrase",
      "required": false
    }
  }
}
