{
  "version": 1,
  "channel_id": "ch-46",
  "strategy": "GEOSPATIAL_RADIUS",
  "name": "ch-46-geospatial-radius-interior-room",
  "intent": "A distance is drawn on real ground and what falls inside it becomes visible. Here that is figure silhouette on a room's floor and back wall, furniture implied at the edges.",
  "environment": {
    "type": "interior-room",
    "ground": "a room's floor and back wall, furniture implied at the edges",
    "lighting": "soft-diffuse"
  },
  "objects": [
    {
      "object": "figure silhouette",
      "role": "subject",
      "anchor": {
        "x": 0.46,
        "y": 0.48,
        "scale": 1
      }
    },
    {
      "object": "answer frame",
      "role": "supporting",
      "anchor": {
        "x": 0.76,
        "y": 0.3,
        "scale": 0.6
      }
    },
    {
      "object": "desk edge",
      "role": "context",
      "anchor": {
        "x": 0.24,
        "y": 0.72,
        "scale": 0.62
      }
    }
  ],
  "camera_path": [
    {
      "at": 0,
      "move": "static",
      "reason": "the extent is established before anything is said about it"
    },
    {
      "at": 0.55,
      "move": "push-in",
      "target": "figure silhouette",
      "reason": "the frame closes on the boundary itself"
    },
    {
      "at": 1,
      "move": "tilt-up",
      "reason": "the edge holds so what it encloses can be read"
    }
  ],
  "typography": [
    {
      "slot": "{unit}",
      "face": "secondary",
      "placement": "centre",
      "in_at": 0.12,
      "out_at": 1
    }
  ],
  "transitions": [
    {
      "to": "next",
      "type": "simple-cut",
      "duration_frames": 10
    }
  ],
  "parameters": {
    "value": {
      "type": "number",
      "from": "script-number",
      "required": true
    },
    "unit": {
      "type": "text",
      "from": "script-phrase",
      "required": false
    }
  }
}
