{
  "version": 1,
  "channel_id": "ch-07",
  "strategy": "ACCUMULATION",
  "name": "ch-07-accumulation-corporate-interior",
  "intent": "Several separate things exist at once, and together they weigh more than any one of them. Here that is stock ticker tape on a glazed office floor, the city implied beyond it.",
  "environment": {
    "type": "corporate-interior",
    "ground": "a glazed office floor, the city implied beyond it",
    "lighting": "soft-diffuse"
  },
  "objects": [
    {
      "object": "stock ticker tape",
      "role": "subject",
      "anchor": {
        "x": 0.5,
        "y": 0.5,
        "scale": 1
      },
      "repeats": "total",
      "repeat_note": "symbolic: copies standing for the stated total, not a count of real instances"
    },
    {
      "object": "share price line",
      "role": "supporting",
      "anchor": {
        "x": 0.24,
        "y": 0.76,
        "scale": 0.78
      }
    },
    {
      "object": "balance sheet",
      "role": "context",
      "anchor": {
        "x": 0.78,
        "y": 0.78,
        "scale": 0.82
      }
    }
  ],
  "camera_path": [
    {
      "at": 0,
      "move": "pull-out",
      "reason": "the whole surface reads as one place before anything lands on it"
    },
    {
      "at": 0.55,
      "move": "push-in",
      "target": "stock ticker tape",
      "reason": "the pile is the point; the frame closes on it as it grows"
    },
    {
      "at": 1,
      "move": "low-angle",
      "reason": "the last one lands and the frame holds so the total is legible"
    }
  ],
  "typography": [
    {
      "slot": "{label}",
      "face": "secondary",
      "placement": "lower-third",
      "in_at": 0.28,
      "out_at": 1
    }
  ],
  "transitions": [
    {
      "to": "next",
      "type": "glass-break",
      "duration_frames": 14
    }
  ],
  "parameters": {
    "total": {
      "type": "number",
      "from": "script-number",
      "required": true,
      "max_items": 6
    },
    "label": {
      "type": "text",
      "from": "script-phrase",
      "required": false
    }
  }
}
