{
  "version": 1,
  "channel_id": "ch-03",
  "strategy": "RELATIONSHIP",
  "name": "ch-03-relationship-screen-interface",
  "intent": "Several entities and the connections that actually run between them. Here that is benchmark bar on the flat plane of a display, chrome implied not drawn.",
  "environment": {
    "type": "screen-interface",
    "ground": "the flat plane of a display, chrome implied not drawn",
    "lighting": "screen-glow"
  },
  "objects": [
    {
      "object": "benchmark bar",
      "role": "subject",
      "anchor": {
        "x": 0.46,
        "y": 0.48,
        "scale": 1
      },
      "repeats": "nodes"
    },
    {
      "object": "latency trace",
      "role": "supporting",
      "anchor": {
        "x": 0.76,
        "y": 0.3,
        "scale": 0.6
      }
    },
    {
      "object": "output transcript",
      "role": "context",
      "anchor": {
        "x": 0.24,
        "y": 0.72,
        "scale": 0.62
      }
    }
  ],
  "camera_path": [
    {
      "at": 0,
      "move": "pan-right",
      "reason": "the entities are placed before any link is drawn"
    },
    {
      "at": 0.55,
      "move": "push-in",
      "target": "benchmark bar",
      "reason": "the camera moves around the arrangement so the links read as depth not overlap"
    },
    {
      "at": 1,
      "move": "high-angle",
      "reason": "the finished network holds"
    }
  ],
  "typography": [
    {
      "slot": "{label}",
      "face": "secondary",
      "placement": "upper-third",
      "in_at": 0.6,
      "out_at": 1
    }
  ],
  "transitions": [
    {
      "to": "next",
      "type": "glitch-cut",
      "duration_frames": 22
    }
  ],
  "parameters": {
    "nodes": {
      "type": "list",
      "from": "script-list",
      "required": true,
      "max_items": 5
    },
    "label": {
      "type": "text",
      "from": "script-phrase",
      "required": false
    }
  }
}
