{
  "version": 1,
  "channel_id": "ch-47",
  "strategy": "TIMELINE",
  "name": "ch-47-timeline-screen-interface",
  "intent": "Things happened in an order, laid along a real axis rather than described as a list. Here that is calendar grid on the flat plane of a display, chrome implied not drawn.",
  "environment": {
    "type": "screen-interface",
    "ground": "the flat plane of a display, chrome implied not drawn",
    "lighting": "screen-glow"
  },
  "objects": [
    {
      "object": "calendar grid",
      "role": "subject",
      "anchor": {
        "x": 0.5,
        "y": 0.42,
        "scale": 1
      },
      "repeats": "events"
    },
    {
      "object": "clock face",
      "role": "supporting",
      "anchor": {
        "x": 0.2,
        "y": 0.74,
        "scale": 0.7
      }
    },
    {
      "object": "plan comparison rows",
      "role": "context",
      "anchor": {
        "x": 0.8,
        "y": 0.74,
        "scale": 0.7
      }
    }
  ],
  "camera_path": [
    {
      "at": 0,
      "move": "high-angle",
      "reason": "the axis is established before anything is placed on it"
    },
    {
      "at": 0.55,
      "move": "pan-left",
      "target": "calendar grid",
      "reason": "the camera travels the axis in the direction time runs"
    },
    {
      "at": 1,
      "move": "push-in",
      "reason": "the last event lands and the whole span is in frame"
    }
  ],
  "typography": [
    {
      "slot": "{label}",
      "face": "secondary",
      "placement": "lower-third",
      "in_at": 0.12,
      "out_at": 1
    }
  ],
  "transitions": [
    {
      "to": "next",
      "type": "plan-compare",
      "duration_frames": 10
    }
  ],
  "parameters": {
    "events": {
      "type": "list",
      "from": "script-list",
      "required": true,
      "max_items": 5
    },
    "label": {
      "type": "text",
      "from": "script-phrase",
      "required": false
    }
  }
}
