{
  "version": 1,
  "channel_id": "ch-26",
  "strategy": "ACCUMULATION",
  "name": "ch-26-accumulation-evidence-board",
  "intent": "Several separate things exist at once, and together they weigh more than any one of them. Here that is court document on a board surface things are pinned to.",
  "environment": {
    "type": "evidence-board",
    "ground": "a board surface things are pinned to",
    "lighting": "raking-side"
  },
  "objects": [
    {
      "object": "court document",
      "role": "subject",
      "anchor": {
        "x": 0.5,
        "y": 0.5,
        "scale": 1
      },
      "repeats": "total",
      "repeat_note": "symbolic: copies standing for the stated total, not a count of real instances"
    },
    {
      "object": "money trail",
      "role": "supporting",
      "anchor": {
        "x": 0.24,
        "y": 0.76,
        "scale": 0.78
      }
    },
    {
      "object": "ledger notebook",
      "role": "context",
      "anchor": {
        "x": 0.78,
        "y": 0.78,
        "scale": 0.82
      }
    }
  ],
  "camera_path": [
    {
      "at": 0,
      "move": "push-in",
      "reason": "the whole surface reads as one place before anything lands on it"
    },
    {
      "at": 0.55,
      "move": "track-right",
      "target": "court document",
      "reason": "the pile is the point; the frame closes on it as it grows"
    },
    {
      "at": 1,
      "move": "static",
      "reason": "the last one lands and the frame holds so the total is legible"
    }
  ],
  "typography": [
    {
      "slot": "{label}",
      "face": "secondary",
      "placement": "upper-third",
      "in_at": 0.28,
      "out_at": 1
    }
  ],
  "transitions": [
    {
      "to": "next",
      "type": "glitch-digital",
      "duration_frames": 14
    }
  ],
  "parameters": {
    "total": {
      "type": "number",
      "from": "script-number",
      "required": true,
      "max_items": 6
    },
    "label": {
      "type": "text",
      "from": "script-phrase",
      "required": false
    }
  }
}
