{
  "version": 1,
  "channel_id": "ch-02",
  "strategy": "BEFORE_AFTER",
  "name": "ch-02-before-after-courtroom",
  "intent": "The same frame under two conditions, with everything except the condition held constant. Here that is gavel on the dark panelling and bench of a courtroom.",
  "environment": {
    "type": "courtroom",
    "ground": "the dark panelling and bench of a courtroom",
    "lighting": "hard-directional"
  },
  "objects": [
    {
      "object": "gavel",
      "role": "subject",
      "anchor": {
        "x": 0.3,
        "y": 0.5,
        "scale": 0.92
      }
    },
    {
      "object": "gavel",
      "role": "supporting",
      "anchor": {
        "x": 0.7,
        "y": 0.5,
        "scale": 0.92
      }
    },
    {
      "object": "police dashcam frame",
      "role": "context",
      "anchor": {
        "x": 0.5,
        "y": 0.84,
        "scale": 0.6
      }
    }
  ],
  "camera_path": [
    {
      "at": 0,
      "move": "static",
      "reason": "the first condition is established alone"
    },
    {
      "at": 0.55,
      "move": "tilt-down",
      "target": "gavel",
      "reason": "the camera crosses to the second with the framing unchanged"
    },
    {
      "at": 1,
      "move": "pan-right",
      "reason": "both are held so the difference is the only thing that moved"
    }
  ],
  "typography": [
    {
      "slot": "{label}",
      "face": "secondary",
      "placement": "upper-third",
      "in_at": 0.12,
      "out_at": 1
    }
  ],
  "transitions": [
    {
      "to": "next",
      "type": "document-reveal",
      "duration_frames": 10
    }
  ],
  "parameters": {
    "label": {
      "type": "text",
      "from": "script-phrase",
      "required": false
    }
  }
}
