{
  "version": 1,
  "channel_id": "ch-48",
  "strategy": "VISUAL_METAPHOR",
  "name": "ch-48-visual-metaphor-industrial-floor",
  "intent": "An abstract idea given physical behaviour, using objects this channel already owns. Here that is robot arm on a painted concrete floor with machine bases on it.",
  "environment": {
    "type": "industrial-floor",
    "ground": "a painted concrete floor with machine bases on it",
    "lighting": "flat-overhead"
  },
  "objects": [
    {
      "object": "robot arm",
      "role": "subject",
      "anchor": {
        "x": 0.5,
        "y": 0.46,
        "scale": 1
      }
    },
    {
      "object": "gauge dial",
      "role": "supporting",
      "anchor": {
        "x": 0.5,
        "y": 0.8,
        "scale": 0.72
      }
    },
    {
      "object": "component part",
      "role": "context",
      "anchor": {
        "x": 0.22,
        "y": 0.26,
        "scale": 0.55
      }
    }
  ],
  "camera_path": [
    {
      "at": 0,
      "move": "track-right",
      "reason": "the physical arrangement is established before it is asked to mean anything"
    },
    {
      "at": 0.55,
      "move": "push-in",
      "target": "robot arm",
      "reason": "the camera moves so the behaviour reads as behaviour"
    },
    {
      "at": 1,
      "move": "pan-left",
      "reason": "the arrangement holds in its changed state"
    }
  ],
  "typography": [
    {
      "slot": "{label}",
      "face": "secondary",
      "placement": "upper-third",
      "in_at": 0.44,
      "out_at": 1
    }
  ],
  "transitions": [
    {
      "to": "next",
      "type": "cross-section-reveal",
      "duration_frames": 18
    }
  ],
  "parameters": {
    "label": {
      "type": "text",
      "from": "script-phrase",
      "required": false
    }
  }
}
