{
  "version": 1,
  "channel_id": "ch-04",
  "strategy": "VISUAL_METAPHOR",
  "name": "ch-04-visual-metaphor-archive-photo",
  "intent": "An abstract idea given physical behaviour, using objects this channel already owns. Here that is handwritten letter on the mount board an archival print is laid on.",
  "environment": {
    "type": "archive-photo",
    "ground": "the mount board an archival print is laid on",
    "lighting": "raking-side"
  },
  "objects": [
    {
      "object": "handwritten letter",
      "role": "subject",
      "anchor": {
        "x": 0.5,
        "y": 0.46,
        "scale": 1
      }
    },
    {
      "object": "date marker",
      "role": "supporting",
      "anchor": {
        "x": 0.5,
        "y": 0.8,
        "scale": 0.72
      }
    },
    {
      "object": "archival map sheet",
      "role": "context",
      "anchor": {
        "x": 0.22,
        "y": 0.26,
        "scale": 0.55
      }
    }
  ],
  "camera_path": [
    {
      "at": 0,
      "move": "push-in",
      "reason": "the physical arrangement is established before it is asked to mean anything"
    },
    {
      "at": 0.55,
      "move": "pull-out",
      "target": "handwritten letter",
      "reason": "the camera moves so the behaviour reads as behaviour"
    },
    {
      "at": 1,
      "move": "tilt-down",
      "reason": "the arrangement holds in its changed state"
    }
  ],
  "typography": [
    {
      "slot": "{label}",
      "face": "secondary",
      "placement": "lower-third",
      "in_at": 0.44,
      "out_at": 1
    }
  ],
  "transitions": [
    {
      "to": "next",
      "type": "document-slide",
      "duration_frames": 18
    }
  ],
  "parameters": {
    "label": {
      "type": "text",
      "from": "script-phrase",
      "required": false
    }
  }
}
