{
  "version": 1,
  "channel_id": "ch-11",
  "strategy": "VISUAL_METAPHOR",
  "name": "ch-11-visual-metaphor-orbital-space",
  "intent": "An abstract idea given physical behaviour, using objects this channel already owns. Here that is galaxy spiral on open space, a star field standing in for distance.",
  "environment": {
    "type": "orbital-space",
    "ground": "open space, a star field standing in for distance",
    "lighting": "hard-directional"
  },
  "objects": [
    {
      "object": "galaxy spiral",
      "role": "subject",
      "anchor": {
        "x": 0.5,
        "y": 0.46,
        "scale": 1
      }
    },
    {
      "object": "scale bar",
      "role": "supporting",
      "anchor": {
        "x": 0.5,
        "y": 0.8,
        "scale": 0.72
      }
    },
    {
      "object": "orbit path",
      "role": "context",
      "anchor": {
        "x": 0.22,
        "y": 0.26,
        "scale": 0.55
      }
    }
  ],
  "camera_path": [
    {
      "at": 0,
      "move": "track-left",
      "reason": "the physical arrangement is established before it is asked to mean anything"
    },
    {
      "at": 0.55,
      "move": "pull-out",
      "target": "galaxy spiral",
      "reason": "the camera moves so the behaviour reads as behaviour"
    },
    {
      "at": 1,
      "move": "tilt-up",
      "reason": "the arrangement holds in its changed state"
    }
  ],
  "typography": [
    {
      "slot": "{label}",
      "face": "secondary",
      "placement": "corner-overlay",
      "in_at": 0.44,
      "out_at": 1
    }
  ],
  "transitions": [
    {
      "to": "next",
      "type": "cross-dissolve-cosmic",
      "duration_frames": 18
    }
  ],
  "parameters": {
    "label": {
      "type": "text",
      "from": "script-phrase",
      "required": false
    }
  }
}
