{
  "version": 1,
  "channel_id": "ch-47",
  "strategy": "GEOSPATIAL_RADIUS",
  "name": "ch-47-geospatial-radius-screen-interface",
  "intent": "A distance is drawn on real ground and what falls inside it becomes visible. Here that is calendar grid on the flat plane of a display, chrome implied not drawn.",
  "environment": {
    "type": "screen-interface",
    "ground": "the flat plane of a display, chrome implied not drawn",
    "lighting": "screen-glow"
  },
  "objects": [
    {
      "object": "calendar grid",
      "role": "subject",
      "anchor": {
        "x": 0.46,
        "y": 0.48,
        "scale": 1
      }
    },
    {
      "object": "enrollment form",
      "role": "supporting",
      "anchor": {
        "x": 0.76,
        "y": 0.3,
        "scale": 0.6
      }
    },
    {
      "object": "application window",
      "role": "context",
      "anchor": {
        "x": 0.24,
        "y": 0.72,
        "scale": 0.62
      }
    }
  ],
  "camera_path": [
    {
      "at": 0,
      "move": "static",
      "reason": "the extent is established before anything is said about it"
    },
    {
      "at": 0.55,
      "move": "high-angle",
      "target": "calendar grid",
      "reason": "the frame closes on the boundary itself"
    },
    {
      "at": 1,
      "move": "push-in",
      "reason": "the edge holds so what it encloses can be read"
    }
  ],
  "typography": [
    {
      "slot": "{unit}",
      "face": "secondary",
      "placement": "lower-third",
      "in_at": 0.12,
      "out_at": 1
    }
  ],
  "transitions": [
    {
      "to": "next",
      "type": "fade-section",
      "duration_frames": 10
    }
  ],
  "parameters": {
    "value": {
      "type": "number",
      "from": "script-number",
      "required": true
    },
    "unit": {
      "type": "text",
      "from": "script-phrase",
      "required": false
    }
  }
}
