{
  "version": 1,
  "channel_id": "ch-35",
  "strategy": "IMAGE_EVIDENCE",
  "name": "ch-35-image-evidence-machine-mechanism",
  "intent": "A real sourced image, shown because of what it proves rather than as decoration. Here that is gear train on the cut plane of an assembly, drawn as a section.",
  "environment": {
    "type": "machine-mechanism",
    "ground": "the cut plane of an assembly, drawn as a section",
    "lighting": "hard-directional"
  },
  "objects": [
    {
      "object": "gear train",
      "role": "subject",
      "anchor": {
        "x": 0.5,
        "y": 0.48,
        "scale": 1.05
      }
    },
    {
      "object": "bolt joint",
      "role": "supporting",
      "anchor": {
        "x": 0.78,
        "y": 0.8,
        "scale": 0.5
      }
    },
    {
      "object": "cross section",
      "role": "context",
      "anchor": {
        "x": 0.22,
        "y": 0.8,
        "scale": 0.5
      }
    }
  ],
  "camera_path": [
    {
      "at": 0,
      "move": "high-angle",
      "reason": "the image is given the frame to itself"
    },
    {
      "at": 0.55,
      "move": "pan-left",
      "target": "gear train",
      "reason": "the camera moves to the part of it that carries the claim"
    },
    {
      "at": 1,
      "move": "track-right",
      "reason": "it holds while the claim is made"
    }
  ],
  "typography": [
    {
      "slot": "{asset}",
      "face": "secondary",
      "placement": "corner-overlay",
      "in_at": 0.28,
      "out_at": 1
    }
  ],
  "transitions": [
    {
      "to": "next",
      "type": "3d-flythrough",
      "duration_frames": 14
    }
  ],
  "parameters": {
    "asset": {
      "type": "text",
      "from": "script-entity",
      "required": true
    }
  }
}
