{
  "version": 1,
  "channel_id": "ch-17",
  "strategy": "TRANSFORMATION",
  "name": "ch-17-transformation-archive-photo",
  "intent": "One value becomes another, and the mechanism between them is shown rather than asserted. Here that is archival map sheet on the mount board an archival print is laid on.",
  "environment": {
    "type": "archive-photo",
    "ground": "the mount board an archival print is laid on",
    "lighting": "raking-side"
  },
  "objects": [
    {
      "object": "archival map sheet",
      "role": "subject",
      "anchor": {
        "x": 0.3,
        "y": 0.5,
        "scale": 0.92
      }
    },
    {
      "object": "period painting",
      "role": "supporting",
      "anchor": {
        "x": 0.7,
        "y": 0.5,
        "scale": 0.92
      }
    },
    {
      "object": "stone monument",
      "role": "context",
      "anchor": {
        "x": 0.5,
        "y": 0.84,
        "scale": 0.6
      }
    }
  ],
  "camera_path": [
    {
      "at": 0,
      "move": "pan-right",
      "reason": "both states are in frame from the start so the change has somewhere to go"
    },
    {
      "at": 0.55,
      "move": "high-angle",
      "target": "archival map sheet",
      "reason": "the camera crosses from the old state to the new one"
    },
    {
      "at": 1,
      "move": "push-in",
      "reason": "the new state holds alone"
    }
  ],
  "typography": [
    {
      "slot": "{label}",
      "face": "secondary",
      "placement": "lower-third",
      "in_at": 0.44,
      "out_at": 1
    }
  ],
  "transitions": [
    {
      "to": "next",
      "type": "map-morph",
      "duration_frames": 18
    }
  ],
  "parameters": {
    "from": {
      "type": "number",
      "from": "script-number",
      "required": true
    },
    "to": {
      "type": "number",
      "from": "script-number",
      "required": true
    },
    "label": {
      "type": "text",
      "from": "script-phrase",
      "required": false
    }
  }
}
