{
  "version": 1,
  "channel_id": "ch-26",
  "strategy": "TIMELINE",
  "name": "ch-26-timeline-evidence-board",
  "intent": "Things happened in an order, laid along a real axis rather than described as a list. Here that is wire node on a board surface things are pinned to.",
  "environment": {
    "type": "evidence-board",
    "ground": "a board surface things are pinned to",
    "lighting": "raking-side"
  },
  "objects": [
    {
      "object": "wire node",
      "role": "subject",
      "anchor": {
        "x": 0.5,
        "y": 0.42,
        "scale": 1
      },
      "repeats": "events"
    },
    {
      "object": "ledger notebook",
      "role": "supporting",
      "anchor": {
        "x": 0.2,
        "y": 0.74,
        "scale": 0.7
      }
    },
    {
      "object": "money trail",
      "role": "context",
      "anchor": {
        "x": 0.8,
        "y": 0.74,
        "scale": 0.7
      }
    }
  ],
  "camera_path": [
    {
      "at": 0,
      "move": "track-right",
      "reason": "the axis is established before anything is placed on it"
    },
    {
      "at": 0.55,
      "move": "static",
      "target": "wire node",
      "reason": "the camera travels the axis in the direction time runs"
    },
    {
      "at": 1,
      "move": "top-down",
      "reason": "the last event lands and the whole span is in frame"
    }
  ],
  "typography": [
    {
      "slot": "{label}",
      "face": "secondary",
      "placement": "upper-third",
      "in_at": 0.12,
      "out_at": 1
    }
  ],
  "transitions": [
    {
      "to": "next",
      "type": "glitch-digital",
      "duration_frames": 10
    }
  ],
  "parameters": {
    "events": {
      "type": "list",
      "from": "script-list",
      "required": true,
      "max_items": 5
    },
    "label": {
      "type": "text",
      "from": "script-phrase",
      "required": false
    }
  }
}
