{
  "version": 1,
  "channel_id": "ch-47",
  "strategy": "SCALE_COMPARISON",
  "name": "ch-47-scale-comparison-screen-interface",
  "intent": "How big a number is, set against something that gives it size. Here that is calendar grid on the flat plane of a display, chrome implied not drawn.",
  "environment": {
    "type": "screen-interface",
    "ground": "the flat plane of a display, chrome implied not drawn",
    "lighting": "screen-glow"
  },
  "objects": [
    {
      "object": "calendar grid",
      "role": "subject",
      "anchor": {
        "x": 0.3,
        "y": 0.5,
        "scale": 0.92
      }
    },
    {
      "object": "benefit rule",
      "role": "supporting",
      "anchor": {
        "x": 0.7,
        "y": 0.5,
        "scale": 0.92
      }
    },
    {
      "object": "enrollment form",
      "role": "context",
      "anchor": {
        "x": 0.5,
        "y": 0.84,
        "scale": 0.6
      }
    }
  ],
  "camera_path": [
    {
      "at": 0,
      "move": "pan-left",
      "reason": "the reference object is in frame first so the scale is honest"
    },
    {
      "at": 0.55,
      "move": "push-in",
      "target": "calendar grid",
      "reason": "the frame pulls back to admit the quantity being measured"
    },
    {
      "at": 1,
      "move": "high-angle",
      "reason": "both are held at one scale"
    }
  ],
  "typography": [
    {
      "slot": "{label}",
      "face": "secondary",
      "placement": "lower-third",
      "in_at": 0.28,
      "out_at": 1
    }
  ],
  "transitions": [
    {
      "to": "next",
      "type": "plan-compare",
      "duration_frames": 14
    }
  ],
  "parameters": {
    "value": {
      "type": "number",
      "from": "script-number",
      "required": true
    },
    "label": {
      "type": "text",
      "from": "script-phrase",
      "required": false
    }
  }
}
